"統一編號","公司名稱","負責人","公司地址","實收資本額","公司狀態","產製日期"
"45101019","飛想魚運動行銷有限公司","","新竹縣竹東鎮東昇路6巷12號1樓","0","解散","2017-11-01 03:32:41.01"
"45102122","妮采精品有限公司","孫O君","桃園市桃園區中信里逸林街104號3樓","null","核准設立","2017-11-01 03:32:41.01"
"45102663","歐克健康國際股份有限公司","賴O德","新竹市公道五路二段91號6樓","10000000","核准設立","2017-11-01 03:32:41.01"
"45102782","樹院子可持續股份有限公司","江O淵","新竹縣竹北市光明六路東二段381號1樓","13500000","核准設立","2017-11-01 03:32:41.01"
"45102951","智見科技股份有限公司","蔡O盛","新竹縣竹北市新崙里中華路11巷20號","5000000","核准設立","2017-11-01 03:32:41.01"
"45107858","日泰城股份有限公司","陳O安","澎湖縣馬公市啟明里民權路32號1樓","140000000","核准設立","2017-11-01 03:32:41.01"
"45108408","湘苡國際股份有限公司","潘O湘","桃園市中壢區環西路二段222號","1000000","核准設立","2017-11-01 03:32:41.01"
"45108913","美麗媽國際教育有限公司","吳O展","彰化縣員林市南平里新生路528巷16號4樓","null","核准設立","2017-11-01 03:32:41.01"
"45110360","杏州醫藥股份有限公司","陳O如","桃園市龜山區文化里復興一路108巷1號3樓之1","95000000","核准設立","2017-11-01 03:32:41.01"
"45110523","愛食購有限公司","李O倢","新竹縣竹北市縣政二路55號3樓之12","0","核准設立","2017-11-01 03:32:41.01"
"45110642","恆福科技有限公司","郭O珠","基隆市七堵區自治街23之2號3樓","0","核准設立","2017-11-01 03:32:41.01"
"45111419","玉水企業有限公司","郭O鴻","基隆市中正區正榮街32號5樓","null","核准設立","2017-11-01 03:32:41.01"
"45111699","台灣神山食品有限公司","林O凱","彰化縣彰化市南瑤里中正路二段668號","0","核准設立","2017-11-01 03:32:41.01"
"45113319","富立宏有限公司","柳O華","苗栗縣通霄鎮白東里9鄰白東61號","null","核准設立","2017-11-01 03:32:41.01"
"45113401","歐遊國際股份有限公司","林O彥","雲林縣斗六市棒球十三街18號","213333350","核准設立","2017-11-01 03:32:41.01"
"45115267","台歆環保材料有限公司","姜O勻","桃園市八德區大興里榮興南路1之28號1樓","0","核准設立","2017-11-01 03:32:41.01"
"45115766","康儷潔有限公司","林O聖","花蓮縣吉安鄉吉安村吉昌二街194巷22號1樓","0","核准設立","2017-11-01 03:32:41.01"
"45115800","科呈生技有限公司","吳O錦","南投縣國姓鄉長流村大長路500-8號","null","核准設立","2017-11-01 03:32:41.01"
"45116717","口袋市集股份有限公司","","桃園市觀音區草新里四維路75巷20號2樓","750000","解散","2017-11-01 03:32:41.01"
"45117238","逗客科技股份有限公司","鄒O薇","桃園市蘆竹區順興里南順四街37號七樓","3000000","核准設立","2017-11-01 03:32:41.01"
"45117271","研耘科技股份有限公司","陳O弘","桃園市中壢區金華里慈惠三街153號12樓","15000000","核准設立","2017-11-01 03:32:41.01"
"45117379","頂原建設股份有限公司","黃O儀","屏東縣屏東市湖南里歸禮巷71號","13600000","核准設立","2017-11-01 03:32:41.01"
"45117434","虹僑國際有限公司","陳O霖","桃園市八德區中華路31巷18號15樓","null","核准設立","2017-11-01 03:32:41.01"
"45121388","稻穗企業有限公司","林O德","花蓮縣瑞穗鄉祥瑞村五福路325號","null","核准設立","2017-11-01 03:32:41.01"
"45121628","全大企業股份有限公司","曾O全","桃園市平鎮區北安里延平路一段2號3樓","5000000","核准設立","2017-11-01 03:32:41.01"
"45124744","匯益投顧有限公司","楊O毅","雲林縣虎尾鎮公安里林森路一段360巷128號","0","核准設立","2017-11-01 03:32:41.01"
"45126715","玉皇大帝有限公司","黃O銘","雲林縣虎尾鎮新吉里工專一街69號","null","核准設立","2017-11-01 03:32:41.01"
"45128903","威博登有限公司","丁O唯","雲林縣臺西鄉泉州村泉州路23-1號","0","核准設立","2017-11-01 03:32:41.01"
"45129852","台灣健康美學有限公司","李O騰","高雄市仁武區大景二街97號2樓","0","核准設立","2017-11-01 03:32:41.01"
"45130128","威逖國際企業有限公司","鄭O鴻","高雄市燕巢區深興路150號1樓","null","核准設立","2017-11-01 03:32:41.01"
"45131230","開源電商有限公司","王O佑","高雄市鳳山區真君路72巷6號1樓","null","核准設立","2017-11-01 03:32:41.01"
"45131533","國群網通有限公司","黃O貞","高雄市鳥松區球場路21號1樓","null","核准設立","2017-11-01 03:32:41.01"
"45132673","諾亞方舟文創股份有限公司","徐O志","高雄市前金區中正四路235號17樓之1","2000000","核准設立","2017-11-01 03:32:41.01"
"45133477","中天聖國物流股份有限公司","吳O真","高雄市苓雅區自強三路3號12樓之33","100000","核准設立","2017-11-01 03:32:41.01"
"45133531","天億事業股份有限公司","劉O憲","花蓮縣吉安鄉仁安村南濱路一段116-2號","5000000","核准設立","2017-11-01 03:32:41.01"
"45133618","魯笠將創意有限公司","林O賢","高雄市仁武區京富路62號","0","核准設立","2017-11-01 03:32:41.01"
"45133650","瀧誠實業有限公司","廖O兆麒","高雄市左營區左營大路14之7號1樓","0","核准設立","2017-11-01 03:32:41.01"
"45134222","百茗生物科技有限公司","廖O秦","高雄市鼓山區裕誠路1633號1樓","0","核准設立","2017-11-01 03:32:41.01"
"45134503","杏田醫務管理顧問有限公司","張O娟","高雄市三民區九如一路551號14樓之1","0","核准設立","2017-11-01 03:32:41.01"
"45136426","膠仙生物科技有限公司","莊O淳","高雄市岡山區中山南路71號1樓","0","核准設立","2017-11-01 03:32:41.01"
"45136609","九丹生物科技有限公司","謝O陽","高雄市鳳山區鳳甲二街125巷10號12樓","0","核准設立","2017-11-01 03:32:41.01"
"45137826","青山淨水有限公司","林O君","高雄市三民區大和街71號1樓","null","核准設立","2017-11-01 03:32:41.01"
"45140147","速博健康管理顧問有限公司","王O棠","高雄市三民區建興路351號","0","核准設立","2017-11-01 03:32:41.01"
"45140408","台灣林達貿易有限公司","張O華","高雄市苓雅區成功一路232號11樓之3","0","核准設立","2017-11-01 03:32:41.01"
"45142665","安象有限公司","邱O志","高雄市左營區文自路827號12樓","0","核准設立","2017-11-01 03:32:41.01"
"45142840","棧邦有限公司","盧O華","高雄市鳳山區文濱路136號1樓","0","核准設立","2017-11-01 03:32:41.01"
"45142927","宇蒼國際企業有限公司","林O郎","高雄市鳥松區松浦北巷3之3號","null","核准設立","2017-11-01 03:32:41.01"
"45142969","鉑洋股份有限公司","陳O文","高雄市大社區中華路268號2樓","6000000","核准設立","2017-11-01 03:32:41.01"
"45143290","維納斯實業有限公司","林O貴","高雄市楠梓區後勁南路151巷27號1樓","0","核准設立","2017-11-01 03:32:41.01"
"45143995","帝創整合行銷股份有限公司","譚O泰","高雄市鳳山區安寧街62巷1號","2000000","核准設立","2017-11-01 03:32:41.01"
"45144827","唐裹文創有限公司","林O全","高雄市鳳山區五甲一路750號3樓之9","null","核准設立","2017-11-01 03:32:41.01"
"45145023","鹽埕噗國際開發股份有限公司","何O凱","高雄市鹽埕區新樂街152號","12000000","核准設立","2017-11-01 03:32:41.01"
"45145500","紅大福有限公司","安O泰","臺中市西區精明二街67號","0","核准設立","2017-11-01 03:32:41.01"
"45149908","金浤國際股份有限公司","張O駿","臺中市南區忠明南路758號14樓","5000000","核准設立","2017-11-01 03:32:41.01"
"45187873","農偉股份有限公司","黃O堯","臺中市西屯區何仁里永昌一街15號9樓之5","600000","核准設立","2017-11-01 03:32:41.01"
"45189582","德旺通商有限公司","施O伃","臺中市清水區中社里建國路116號3樓","0","核准設立","2017-11-01 03:32:41.01"
"45190271","孟良實業有限公司","周O隆","臺中市西區公益里忠明南路237號9樓之4","0","核准設立","2017-11-01 03:32:41.01"
"45194086","元慶健康生活有限公司","吳O達","臺中市北屯區崇德路二段128號11樓之1","0","核准設立","2017-11-01 03:32:41.01"
"45198365","頜仲國際股份有限公司","王O勇","臺中市西屯區惠來路三段306號1樓","5000000","核准設立","2017-11-01 03:32:41.01"
"45876012","半畝塘有限公司","詹O汶","臺中市西區和龍里成功路469之1號1樓","0","核准設立","2017-11-01 03:32:41.01"
"45879572","宮黛科技股份有限公司","林O宇","臺中市西區公民里五權路2之106號17樓","3000000","核准設立","2017-11-01 03:32:41.01"
"45879952","御信科技有限公司","張O毅","臺中市西屯區大隆路145琥","null","核准設立","2017-11-01 03:32:41.01"
"45880347","亮眼國際有限公司","","臺中市西屯區潮洋里市政北二路236號30樓之2","0","解散","2017-11-01 03:32:41.01"
"45881227","金囍貿易有限公司","林O璋","臺中市北屯區崇德二路一段187號","null","核准設立","2017-11-01 03:32:41.01"
"45883935","文記餐飲管理顧問股份有限公司","陳O宏","臺中市西區民龍里公益路155巷9號7樓之1","7500000","核准設立","2017-11-01 03:32:41.01"
"45885477","祥鑽有限公司","吳O祥","臺中市潭子區頭家東里中興北路一二九號一樓","null","核准設立","2017-11-01 03:32:41.01"
"45885737","鎧浩國際有限公司","賴O涓","臺中市沙鹿區六路里六路九街59巷1號1樓","0","核准設立","2017-11-01 03:32:41.01"
"45886757","臺灣六七八有限公司","金O坤(KIM SANGGON)","臺中市西區民龍里公益路52號7樓之2","0","核准設立","2017-11-01 03:32:41.01"
"45887263","佳博斯國際貿易有限公司","盧O銘","臺中市南屯區大業里大墩路764號3樓之1","null","核准設立","2017-11-01 03:32:41.01"
"45888122","康明世界股份有限公司","陳O照","臺中市中區大墩里三民路二段42之1號4樓之2","20000000","核准設立","2017-11-01 03:32:41.01"
"45890540","毅錡國際數位股份有限公司","江O唯","臺中市西屯區潮洋里市政北二路238號30樓之3","5000000","核准設立","2017-11-01 03:32:41.01"
"45891695","艾莉湯尼有限公司","黃O慈","臺南市新營區南紙里建業路227巷16弄22號7樓之17","null","核准設立","2017-11-01 03:32:41.01"
"45891956","東興電腦有限公司","陳O凱","臺南市東區仁和里利東街５號六樓之１","0","核准設立","2017-11-01 03:32:41.01"
"45892934","東旭國際實業有限公司","梁O明","臺南市永康區中華里小東路593號1樓","0","核准設立","2017-11-01 03:32:41.01"
"45893981","瑞豪開發股份有限公司","廖O龍","臺南市中西區民權路2段158號3樓","30000000","核准設立","2017-11-01 03:32:41.01"
"45895377","天醫開發股份有限公司","陳O聰","臺南市仁德區新田路240巷14號1樓","10000000","核准設立","2017-11-01 03:32:41.01"
"45895691","美申企業有限公司","林O穎","臺南市永康區王行里王行路866巷29弄67號1樓","0","核准設立","2017-11-01 03:32:41.01"
"45897614","泉威科技有限公司","張O秦","臺南市東區仁和里仁和路107巷4號4樓之2","0","核准設立","2017-11-01 03:32:41.01"
"45898732","大天生技股份有限公司","莊O燕","臺南市中西區民生路一段157巷10號1樓","7000000","核准設立","2017-11-01 03:32:41.01"
"45899182","國際城有限公司","黃O勲","新北市三重區中央北路8號(2樓)","0","核准設立","2017-11-01 03:32:41.01"
"45899583","源富開發股份有限公司","陳O光","新北市三重區慈愛街140號2樓","2000000","核准設立","2017-11-01 03:32:41.01"
"45904636","云創環球事業有限公司","黃O豪","新北市樹林區味王街46巷15號","0","核准設立","2017-11-01 03:32:41.01"
"45905874","旺津有限公司","黃O豪","新北市汐止區明峰街297巷3弄3號4樓","null","核准設立","2017-11-01 03:32:41.01"
"45908062","律締有限公司","梁O吉","新北市中和區立德街109號7樓","0","核准設立","2017-11-01 03:32:41.01"
"45911643","錦十事業有限公司","許O心","新北市樹林區龍興街32巷8號3樓","null","核准設立","2017-11-01 03:32:41.01"
"45915824","微笑人生文創有限公司","杜O豪","臺北市萬華區康定路43號","0","核准設立","2017-11-01 03:32:41.01"
"45917365","給你企業股份有限公司","陳O文","高雄市鳳山區光復路174巷3之4號","1000000","核准設立","2017-11-01 03:32:41.01"
"45918408","井見行銷科技有限公司","劉O環","臺北市信義區基隆路2段22號6樓之6","0","核准設立","2017-11-01 03:32:41.01"
"46073645","旋轉木馬股份有限公司","","新北市三重區溪尾街49號2樓","3000000","解散","2017-11-01 03:32:41.01"
"46090807","晶妍國際有限公司","荀O玲","新北市新店區中興路2段221號","null","核准設立","2017-11-01 03:32:41.01"
"46104507","霈承股份有限公司","石O瑄","新北市新莊區中原路105號2樓之1","500000","核准設立","2017-11-01 03:32:41.01"
"46116200","肯娜國際有限公司","李O勳","新北市新店區北宜路2段125之5號6樓","null","核准設立","2017-11-01 03:32:41.01"
"46123645","日出商業開發有限公司","雷O程","新北市五股區成泰路1段2之8號4樓","0","核准設立","2017-11-01 03:32:41.01"
"46187555","泓信實業有限公司","張O雄","桃園市八德區介壽路二段325巷1弄1衖7號","0","核准設立","2017-11-01 03:32:41.01"
"46187767","興和榮開發整合有限公司","黃O甄","臺北市大同區承德路1段46號3樓","0","核准設立","2017-11-01 03:32:41.01"
"46196301","寬鴻冠實業有限公司","張O鈞","新北市林口區信義路386號15樓之1","null","核准設立","2017-11-01 03:32:41.01"
"46223601","天使紀念有限公司","林O翰","臺北市文山區辛亥路4段222巷1號","0","核准設立","2017-11-01 03:32:41.01"
"46248103","奇磊鈺不動產有限公司","相O生","新北市新莊區新北大道2段276號9樓","null","核准設立","2017-11-01 03:32:41.01"
"46265720","金宸國際有限公司","邱O美","新北市泰山區明志路2段372巷9弄9號5樓","0","核准設立","2017-11-01 03:32:41.01"
"46271201","大金車實業有限公司","林O堂","新北市三重區三和路4段20巷82號                         ","0","核准設立","2017-11-01 03:32:41.01"
"46272004","創局興業有限公司","","新北市汐止區康寧街751巷27號11樓之3","0","解散","2017-11-01 03:32:41.01"
"46289504","特瑞樂國際有限公司","羅O豪","新北市淡水區民權路25號22樓之21","0","核准設立","2017-11-01 03:32:41.01"
"46327654","宏騰電腦有限公司","李O承","新北市新莊區新北大道2段181號(2樓)","null","核准設立","2017-11-01 03:32:41.01"
"46359347","大漢建設股份有限公司","賴O煌","新北市永和區保生路1號15樓","70000000","核准設立","2017-11-01 03:32:41.01"
"46452701","直流電通股份有限公司","陳O甫","臺北市松山區南京東路4段45號9樓之1","10700000","核准設立","2017-11-01 03:32:41.01"
"46462285","誠一實業有限公司","李O玲","新北市蘆洲區中正路263巷9號","null","核准設立","2017-11-01 03:32:41.01"
"46467036","台欣企管顧問股份有限公司","陳O武","新北市新莊區復興路3段19號5樓","500000","核准設立","2017-11-01 03:32:41.01"
"46470406","福沃股份有限公司","林O源","新北市新店區建國路233號1樓","5000000","核准設立","2017-11-01 03:32:41.01"
"46480100","新竹物流股份有限公司","許O瑞","新竹縣新豐鄉松柏村德昌街228號","2494931040","核准設立","2017-11-01 03:32:41.01"
"46531109","成益開發有限公司","王O民","新北市永和區林森路48巷3號(1樓)","null","核准設立","2017-11-01 03:32:41.01"
"46554209","恆懿國際貿易股份有限公司","林O宏","新北市深坑區北深路3段307號2樓","3000000","核准設立","2017-11-01 03:32:41.01"
"46581607","隔壁老楊股份有限公司","","新北市三重區中華路20巷2之1號5樓","50000","解散","2017-11-01 03:32:41.01"
"46582269","樂居文創股份有限公司","王O方","新北市樹林區學成路727號12樓","1000000","核准設立","2017-11-01 03:32:41.01"
"46598403","大天沈香事業股份有限公司","郭O麟","臺南市中西區建國里民生路一段157巷10號1樓","1000000","核准設立","2017-11-01 03:32:41.01"
"46606706","凱德吉斯有限公司","黃O怡","臺北市文山區興隆路4段187號1樓","0","核准設立","2017-11-01 03:32:41.01"
"46622311","逗點禮品有限公司","陳O庸","新北市三重區重新路4段65號6樓之3","null","核准設立","2017-11-01 03:32:41.01"
"46644407","俏城市有限公司","倪O媛","新北市土城區明峯街35號12樓","null","核准設立","2017-11-01 03:32:41.01"
"46646685","非思不可行銷有限公司","張O榕","桃園市龜山區東萬壽路12號","0","核准設立","2017-11-01 03:32:41.01"
"46684462","方尹文創有限公司","方O媚","新北市土城區立仁街50號(1樓)","null","核准設立","2017-11-01 03:32:41.01"
"47004843","珍豐餐飲顧問股份有限公司","","新北市土城區中華路1段56巷19號","3000000","解散","2017-11-01 03:32:41.01"
"47012837","庫雷斯國際事業有限公司","廖O硯","新北市三重區三和路4段16號16樓之2","0","核准設立","2017-11-01 03:32:41.01"
"47014835","艾城有限公司","許O雪","新北市八里區觀海大道127號","null","核准設立","2017-11-01 03:32:41.01"
"47015187","品星貿易有限公司","梁O仁","新北市中和區連城路456巷6號6樓","0","核准設立","2017-11-01 03:32:41.01"
"47018895","威達通有限公司","張O民","新北市板橋區雙十路2段6號之8四樓","null","核准設立","2017-11-01 03:32:41.01"
"47024221","台灣天紳生物科技有限公司","王O群","新北市新莊區復興路3段41號1樓","0","核准設立","2017-11-01 03:32:41.01"
"47024720","首璽苑國際貿易有限公司","林O鳴","新北市板橋區文化路2段451號8樓","0","核准設立","2017-11-01 03:32:41.01"
"47027938","金宸系統工程有限公司","蔡O惠","新北市板橋區四川路1段286巷15號1樓","null","核准設立","2017-11-01 03:32:41.01"
"47036140","享漾國際行銷有限公司","楊O文","新北市新莊區中港一街95之1號","0","核准設立","2017-11-01 03:32:41.01"
"47040334","清文室內裝修工程有限公司","鄭O秀錦","新北市新莊區龍安路278巷1號2樓","null","核准設立","2017-11-01 03:32:41.01"
"47043445","杰威科技石材有限公司","周O偉","新北市蘆洲區重陽街72-2號2樓","null","核准設立","2017-11-01 03:32:41.01"
"47047287","美德森有限公司","李O浩","新北市三重區中正北路183號","null","核准設立","2017-11-01 03:32:41.01"
"47050233","勤捷科技有限公司","劉O傑","新北市新莊區民安路188巷5號5樓之29","null","核准設立","2017-11-01 03:32:41.01"
"47060464","永勗興業有限公司","曾O倫","新北市中和區中山路3段112之1號4樓","null","核准設立","2017-11-01 03:32:41.01"
"47066122","品尚國際行銷有限公司","吳O忠","新北市板橋區懷德街139巷20弄19之2號","null","核准設立","2017-11-01 03:32:41.01"
"47067467","禾馨國際企業有限公司","黃O馨","新北市板橋區金門街253巷1號(1樓)","null","核准設立","2017-11-01 03:32:41.01"
"47067706","芮佳食材有限公司","潘O銓","新北市新莊區公園路202巷35號","null","核准設立","2017-11-01 03:32:41.01"
"47071645","銘摩有限公司","林O陽","新北市五股區蓬萊路26號3樓","0","核准設立","2017-11-01 03:32:41.01"
"47074262","木津川時代有限公司","張O惠","新北市八里區龍米路1段370號（1樓）","0","核准設立","2017-11-01 03:32:41.01"
"47075494","迦文有限公司","范O婷","新北市新店區安祥路97巷8號4樓","null","核准設立","2017-11-01 03:32:41.01"
"47086149","星安食創有限公司","葉O邑","新北市中和區民樂路13號9樓","null","核准設立","2017-11-01 03:32:41.01"
"47086231","精采實業有限公司","鄭O宏","新北市三重區三和路4段16號16樓之1","0","核准設立","2017-11-01 03:32:41.01"
"47086437","篁城實業有限公司","莊O勇","新竹縣竹東鎮仁愛里北興路2段117號1樓","null","核准設立","2017-11-01 03:32:41.01"
"47089645","駿綵國際企業有限公司","吳O惠","臺北市南港區東新街94號","0","核准設立","2017-11-01 03:32:41.01"
"47090299","愛家人事業股份有限公司","詹O進","新北市汐止區新台五路1段99號3樓","30000000","核准設立","2017-11-01 03:32:41.01"
"47090312","愛生活國際股份有限公司","李O潤","新北市汐止區新台五路1段99號3樓","30000000","核准設立","2017-11-01 03:32:41.01"
"47090447","海緁麟實業有限公司","許O淳","新北市五股區西雲路185巷1弄2號地下1樓","null","核准設立","2017-11-01 03:32:41.01"
"47091522","屹鞍國際行銷有限公司","林O然","新北市汐止區伯爵街41巷1號（1樓）","null","核准設立","2017-11-01 03:32:41.01"
"47098264","金吉兒寵物事業有限公司","陳O馡","新北市新店區安康路2段77號","null","核准設立","2017-11-01 03:32:41.01"
"47111251","璽鉦國際有限公司","朱O弘","新北市新莊區復興路2段60巷5之4號","null","核准設立","2017-11-01 03:32:41.01"
"47118894","藝立媄生醫科技股份有限公司","","新北市鶯歌區建國路578號(1樓)","1500000","解散","2017-11-01 03:32:41.01"
"47121770","松宸有限公司","楊O柔","新北市淡水區鄒厝崙12之2號","null","核准設立","2017-11-01 03:32:41.01"
"47289600","城安企業股份有限公司","樊O安","新竹市北區武陵里武陵西二路29號1樓","5000000","核准設立","2017-11-01 03:32:41.01"
"49003399","丸利陶器股份有限公司","張O欣","苗栗縣苗栗市水源里水流娘十五號","54000000","核准設立","2017-11-01 03:32:41.01"
"49817135","趙太常蔘藥有限公司","趙O文","苗栗縣苗栗市新苗里2鄰中正路789號","0","核准設立","2017-11-01 03:32:41.01"
"51010635","薩摩亞商澤瑞股份有限公司","王O新","新北市汐止區福德一路452號3樓","0","核准設立","2017-11-01 03:32:41.01"
"51015548","嘉里大榮物流股份有限公司","沈O桂","臺北市中正區新生南路1段50號14樓","4670004980","核准設立","2017-11-01 03:32:41.01"
"51067003","香港商有聲娛樂有限公司","張O梅","臺北市大安區忠孝東路4段221號12樓","0","核准設立","2017-11-01 03:32:41.01"
"51082150","英屬維京群島商澤塔科技有限公司","XO, SHIQI","桃園市桃園區中正路1082號26樓","0","核准設立","2017-11-01 03:32:41.01"
"51087900","名樣運動用品有限公司","黃O勝","金門縣金城鎮北門里中興路146巷27號","0","核准設立","2017-11-01 03:32:41.01"
"51200403","飛龍股份有限公司","周O蔚","連江縣北竿鄉塘岐村273-8號","50000000","核准設立","2017-11-01 03:32:41.01"
"51223200","塞席爾商樂飛亞科技股份有限公司","林O揚","臺北市內湖區陽光街351號4樓之3","0","核准設立","2017-11-01 03:32:41.01"
"51232572","英屬維京群島商昕兆股份有限公司","洪O豪","新北市中和區中原里立德街123號7樓","0","核准設立","2017-11-01 03:32:41.01"
"51258903","塞席爾商頂峯國際開發有限公司","杜O慧","新北市鶯歌區重慶街88號3樓","0","核准設立","2017-11-01 03:32:41.01"
"51318064","香港商阿爾伊股份有限公司","王O萍","臺北市內湖區洲子街101號3樓","0","核准設立","2017-11-01 03:32:41.01"
"51973836","君頤有限公司","許O榆","臺北市南港區成福路206巷4弄2號2樓","null","核准設立","2017-11-01 03:32:41.01"
"52204954","看見資產管理有限公司","張O宣","臺北市中山區中原街148號","null","核准設立","2017-11-01 03:32:41.01"
"52210365","博淵堂知識科技股份有限公司","王O唐","臺北市中正區臨沂街75巷15號地下之26","300000","核准設立","2017-11-01 03:32:41.01"
"52220820","威璽商業有限公司","文O懿","臺北市中正區忠孝東路1段76號12樓之1","0","核准設立","2017-11-01 03:32:41.01"
"52245385","義米國際有限公司","","臺北市大安區復興南路2段160巷26號7樓之3","0","解散","2017-11-01 03:32:41.01"
"52249684","鹿比國際有限公司","黃O容","臺北市松山區新東街6巷6號1樓","null","核准設立","2017-11-01 03:32:41.01"
"52252694","豐帆娛樂製作有限公司","吳O榮","臺北市萬華區和平西路3段368號1樓","0","核准設立","2017-11-01 03:32:41.01"
"52254530","界外設計有限公司","黃O傑","臺北市大安區安居街60巷1號2樓","null","核准設立","2017-11-01 03:32:41.01"
"52261949","樂天利有限公司","吳O璋","臺北市中山區長春路100號8樓之8","null","核准設立","2017-11-01 03:32:41.01"
"52262433","歐易購有限公司","陳O樺","臺北市大安區忠孝東路4段221號12樓","null","核准設立","2017-11-01 03:32:41.01"
"52265733","展望數位資訊股份有限公司","程O純","臺北市萬華區青年路168巷2弄7號","500000","核准設立","2017-11-01 03:32:41.01"
"52266655","崧畯股份有限公司","蔣O澔","臺北市松山區南京東路5段222號10樓","500000","核准設立","2017-11-01 03:32:41.01"
"52266780","和田生活股份有限公司","劉O芳","臺北市中正區重慶南路2段51號8樓","50000000","核准設立","2017-11-01 03:32:41.01"
"52268491","樂軒貿易企業有限公司","謝O暾","臺北市松山區南京東路3段287號9樓","0","核准設立","2017-11-01 03:32:41.01"
"52270200","全球生活有限公司","林O芬","臺北市大安區羅斯福路3段103號2樓","null","核准設立","2017-11-01 03:32:41.01"
