"統一編號","公司名稱","負責人","公司地址","實收資本額","公司狀態","產製日期"
"25144074","正金麒有限公司","金O","臺北市松山區基隆路1段8號11樓之1","0","核准設立","2017-11-01 03:32:41.01"
"25144433","悅豐興業股份有限公司","陳O志","臺北市信義區基隆路1段432號9樓之4","1635000000","核准設立","2017-11-01 03:32:41.01"
"25144525","愛情花園國際建設股份有限公司","楊O宜","臺中市西區大隆路20號9樓之9","25000000","核准設立","2017-11-01 03:32:41.01"
"25144665","世霖國際實業股份有限公司","","臺北市中正區羅斯福路2段126號2樓之1","7000000","解散","2017-11-01 03:32:41.01"
"25145355","先英國際有限公司","洪O倫","新北市三重區河邊北街238號4樓","null","核准設立","2017-11-01 03:32:41.01"
"25146571","御品創點有限公司","","臺北市南港區玉成街166巷25號2樓","null","解散","2017-11-01 03:32:41.01"
"25146988","鼎鐧企業有限公司","李O誠","臺北市大安區仁愛路4段4號3樓","null","核准設立","2017-11-01 03:32:41.01"
"25147543","騰祥國際企業有限公司","","新北市新莊區中華路2段171號10樓","null","解散","2017-11-01 03:32:41.01"
"25148655","信銓國際有限公司","賴O杰","臺北市中正區忠孝西路1段7號6樓之1","null","核准設立","2017-11-01 03:32:41.01"
"25149269","大薰有限公司","翁O平","臺北市中山區民生東路1段58號11樓","null","核准設立","2017-11-01 03:32:41.01"
"25149731","珍愛設計股份有限公司","陳O庭","臺北市文山區羅斯福路5段125號4樓","1000000","核准設立","2017-11-01 03:32:41.01"
"25150292","優力物業股份有限公司","","新北市新莊區丹鳳里14鄰天祥街90號3樓","1700000","解散","2017-11-01 03:32:41.01"
"25150672","大千多媒體股份有限公司","","花蓮縣花蓮市民政里中興路239號1樓","5000000","廢止","2017-11-01 03:32:41.01"
"25154852","廟會王市集科技有限公司","江O璇","桃園市桃園區龍鳳里國豐七街28號1樓","0","核准設立","2017-11-01 03:32:41.01"
"25155655","米立恩國際創意行銷有限公司","","臺北市中正區師大路170之2號1樓","null","解散","2017-11-01 03:32:41.01"
"25155917","羿控科技有限公司","陳O江","新竹縣竹北市東平里8鄰隘口一街1號5樓之8","null","核准設立","2017-11-01 03:32:41.01"
"25156303","力挺國際科技股份有限公司","林O宏","臺中市南區長榮里復興路三段280號2樓","2500000","核准設立","2017-11-01 03:32:41.01"
"25156818","囍多有限公司","楊O淵","基隆市仁愛區愛三路78號1樓","0","核准設立","2017-11-01 03:32:41.01"
"25157957","凌科生活科技有限公司","廖O堂","臺中市東區東英路354號1樓","null","核准設立","2017-11-01 03:32:41.01"
"25160279","翔龍國際企業有限公司","吳O鋒","苗栗縣公館鄉館東村7鄰富東街52號1樓","0","核准設立","2017-11-01 03:32:41.01"
"25161185","凰旭藝文有限公司","","桃園市桃園區南埔里大興西路二段265號17樓之2","null","解散","2017-11-01 03:32:41.01"
"25163965","碁業整合創意策略有限公司","李O靜","臺中市西區臺灣大道二段573號7樓","null","核准設立","2017-11-01 03:32:41.01"
"25165160","億承國際股份有限公司","邱O廷","桃園市大溪區田心里信義路43號4樓","5000000","核准設立","2017-11-01 03:32:41.01"
"25165324","倍臻創研事業有限公司","","臺北市信義區松德路10號5樓","null","解散","2017-11-01 03:32:41.01"
"25169980","南臺灣商業有限公司","曾O林","高雄市小港區宏平路136號1樓","0","核准設立","2017-11-01 03:32:41.01"
"25170635","海派國際股份有限公司","","臺中市神岡區溪洲里神洲路856號1-3樓","10000000","解散","2017-11-01 03:32:41.01"
"25171310","鉑金國際有限公司","李O昌","高雄市鳳山區保安里鳳甲二街125巷22弄21號1樓","null","核准設立","2017-11-01 03:32:41.01"
"25171851","東靚規劃設計有限公司","林O煌","花蓮縣吉安鄉北昌村中央路三段554號1樓","null","核准設立","2017-11-01 03:32:41.01"
"25176455","騎士堡國際事業股份有限公司","葉O綺","臺北市中山區松江路375號11樓","159192270","核准設立","2017-11-01 03:32:41.01"
"25176461","佳客來五金股份有限公司","古O禎","臺中市大里區永隆里國光路二段541號","5000000","核准設立","2017-11-01 03:32:41.01"
"25179087","鯨騰有限公司","","臺中市北區立人里大雅路575號2樓","null","解散","2017-11-01 03:32:41.01"
"25179468","昊宜國際股份有限公司","吳O瑋","新竹市東區光明里大學路228號3樓6","10000000","核准設立","2017-11-01 03:32:41.01"
"25179777","弗克斯百貨事業有限公司","王O心","臺北市內湖區大湖街166巷56號地下之3","0","核准設立","2017-11-01 03:32:41.01"
"25180253","大雅物業有限公司","張O鈞","桃園市桃園區中山路425巷3號7樓之3","0","核准設立","2017-11-01 03:32:41.01"
"25180351","碩輝股份有限公司","黃O弘","彰化縣員林市新生里莒光路432號12樓","2000000","核准設立","2017-11-01 03:32:41.01"
"25180839","瑞康生化科技股份有限公司","","臺北市中山區復興北路290號6樓之3","7000000","解散","2017-11-01 03:32:41.01"
"25181507","日旺網路科技股份有限公司","","臺中市北區忠太東路58-13號1樓","20000000","廢止","2017-11-01 03:32:41.01"
"25183603","南禾貿易有限公司","蕭O真","新北市三重區正義北路2巷64號2樓","null","核准設立","2017-11-01 03:32:41.01"
"25184259","宜大事業股份有限公司","李O楨","宜蘭縣宜蘭市文化里神農路一段89號1樓","3000000","核准設立","2017-11-01 03:32:41.01"
"25185671","裕活興能源股份有限公司","張O玲","臺南市安平區建平里平通路26號1樓","1000000","核准設立","2017-11-01 03:32:41.01"
"25186382","媽媽咪呀有限公司","","臺南市安南區溪東里北安路2段49號","null","解散","2017-11-01 03:32:41.01"
"25186566","天天精彩傳播有限公司","郭O鳳珠","桃園市桃園區中平路102號14樓之1","null","核准設立","2017-11-01 03:32:41.01"
"25187729","倍特利有限公司","林O慧","桃園市桃園區中正五街198號1樓","0","核准設立","2017-11-01 03:32:41.01"
"25188375","台灣生活卡有限公司","","臺中市西區忠明南路270號8樓之2","null","解散","2017-11-01 03:32:41.01"
"25188868","睿創整合服務股份有限公司","","新竹縣竹北市斗崙里縣政八街68巷3號5樓","6000000","解散","2017-11-01 03:32:41.01"
"25189347","三一國際超媒體股份有限公司","陳O謙","臺北市內湖區新湖一路86號1樓","14200000","核准設立","2017-11-01 03:32:41.01"
"25189971","亞太全通科技有限公司","羅O局","臺中市中區大墩里三民路2段42之1號8樓之1","0","核准設立","2017-11-01 03:32:41.01"
"25190772","繪本國際有限公司","","桃園市桃園區大興西路二段37號B1","null","解散","2017-11-01 03:32:41.01"
"25191940","仲妍生物科技股份有限公司","","臺中市大里區長榮里新南路246號","500000","解散","2017-11-01 03:32:41.01"
"25192151","三森丰富有限公司","","桃園市八德區大仁里仁和街248巷42弄8衖8號1樓","null","解散","2017-11-01 03:32:41.01"
"25192440","台灣原民網文創事業股份有限公司","李O德","臺北市中山區長安東路2段178號7樓之4","28000000","核准設立","2017-11-01 03:32:41.01"
"25193567","一訂好國際股份有限公司","王O文","臺中市北屯區旅順路二段191號2樓","27800000","核准設立","2017-11-01 03:32:41.01"
"25194382","碁翊貿易有限公司","","基隆市七堵區百三街21之2號","null","解散","2017-11-01 03:32:41.01"
"25194637","玩秀娛樂科技有限公司","","臺南市永康區勝利里中華路1-37號","null","解散","2017-11-01 03:32:41.01"
"25194720","元新開發有限公司","張O珠","新竹縣竹北市隘口二路258巷30號5樓","0","核准設立","2017-11-01 03:32:41.01"
"25194952","大寶埔里風味餐股份有限公司","","南投縣埔里鎮泰安里民族三街45號1樓","6000000","解散","2017-11-01 03:32:41.01"
"25197780","巨翔開發股份有限公司","許O檍","桃園市桃園區中山路379-1號","50000000","核准設立","2017-11-01 03:32:41.01"
"25198205","准境工程有限公司","葉O辰","桃園市新屋區下田里中山西路2段1181巷6弄2號","null","核准設立","2017-11-01 03:32:41.01"
"25198824","麥克語錄媒體整合設計有限公司","鄭O弘","臺南市永康區小東路685巷43號1樓","null","核准設立","2017-11-01 03:32:41.01"
"27210514","采宥科技有限公司","","高雄市前金區光復二街卅號1樓","null","解散","2017-11-01 03:32:41.01"
"27212344","漢堡先生餐飲事業有限公司","","高雄市楠梓區德明路1006之1號","null","解散","2017-11-01 03:32:41.01"
"27212597","光宇藍有限公司","","高雄市鼓山區裕誠路1119號1樓","null","解散","2017-11-01 03:32:41.01"
"27212750","高雄八五光彩廣場股份有限公司","","高雄市新興區七賢二路8巷13號","10000000","解散","2017-11-01 03:32:41.01"
"27215243","風尚媒體科技有限公司","林O慧","高雄市三民區九如二路597號19樓之7","0","核准設立","2017-11-01 03:32:41.01"
"27217220","藏墨數位藝術股份有限公司","邱O鴻","高雄市三民區正興路163巷10號14樓","5000000","核准設立","2017-11-01 03:32:41.01"
"27218874","長野貿易國際有限公司","","高雄市前鎮區草衙中街103號","null","解散","2017-11-01 03:32:41.01"
"27219509","高琦電子科技股份有限公司","蔡O吟","屏東縣屏東市前進里清進巷84號","5000000","核准設立","2017-11-01 03:32:41.01"
"27220626","天恩尖端科技有限公司","董O祥","高雄市苓雅區新光路62巷15號9樓之1","0","核准設立","2017-11-01 03:32:41.01"
"27221955","光譜國際科技股份有限公司","鄭O凉","高雄市三民區教仁路65號1樓","3000000","核准設立","2017-11-01 03:32:41.01"
"27222357","美奇萊育樂股份有限公司","王O德","高雄市三民區十全一路161號地下1至2樓及2至5樓","5000000","核准設立","2017-11-01 03:32:41.01"
"27224377","艾德盟有限公司","","高雄市苓雅區三多四路110號13樓之4","null","解散","2017-11-01 03:32:41.01"
"27225093","明誠高爾夫貿易有限公司","謝O修","高雄市旗山區大林里溝坪路98-1號3樓之22","null","核准設立","2017-11-01 03:32:41.01"
"27226109","台灣新華農業科技股份有限公司","楊O達","臺東縣臺東市民生里鄭州街15號","10000000","核准設立","2017-11-01 03:32:41.01"
"27229008","仁大興開發有限公司","蔡O瑞","高雄市仁武區文武里中華路426號","null","核准設立","2017-11-01 03:32:41.01"
"27230722","薪茂百貨有限公司","","金門縣金城鎮金水里前水頭一四一號","null","廢止","2017-11-01 03:32:41.01"
"27236232","環宇事業有限公司","何O祥","金門縣金沙鎮浦山里浦邊33之2號","null","核准設立","2017-11-01 03:32:41.01"
"27238436","統一開發股份有限公司","蘇O銘","臺北市信義區忠孝東路5段6號","3600000000","核准設立","2017-11-01 03:32:41.01"
"27240313","香港商雅虎資訊股份有限公司","鄒O蓮","臺北市南港區三重路66號14樓","null","核准設立","2017-11-01 03:32:41.01"
"27245295","金鴻翔國際企業股份有限公司","黃O耕","金門縣金寧鄉榜林村伯玉路1段222-2號","5000000","核准設立","2017-11-01 03:32:41.01"
"27264010","全家網路資訊有限公司","","桃園市桃園區雲林里桃鶯路195號","null","解散","2017-11-01 03:32:41.01"
"27265475","楷朔科技有限公司","冉O川","新北市樹林區保安街3段44號(1樓)","null","核准設立","2017-11-01 03:32:41.01"
"27269009","精緻公關顧問有限公司","林O禎","臺北市大安區信義路4段279號2樓","0","核准設立","2017-11-01 03:32:41.01"
"27271672","勤億有限公司","陳O惠","新竹市東區水源里仰德路90號1樓","null","核准設立","2017-11-01 03:32:41.01"
"27276634","日恒生物科技有限公司","","臺中市北區明德里太原一街２號地下１樓","null","廢止","2017-11-01 03:32:41.01"
"27276661","蠻龍股份有限公司","","桃園市桃園區大同路24號9樓之9","5000000","解散","2017-11-01 03:32:41.01"
"27276923","福重企業有限公司","","桃園市桃園區南埔里大興西路二段２５１號９樓之１","null","解散","2017-11-01 03:32:41.01"
"27277325","達波網有限公司","王O才","新北市新莊區民安路299巷44弄10號","null","核准設立","2017-11-01 03:32:41.01"
"27277583","賜利優醫藥生技有限公司","陳O綸","彰化縣彰化市復興里力行路116號1樓","0","核准設立","2017-11-01 03:32:41.01"
"27278540","思沛克國際有限公司","宋O庭","桃園市桃園區中德里中路北街67巷14弄22號1樓","null","核准設立","2017-11-01 03:32:41.01"
"27284819","日翊文化行銷股份有限公司","薛O都","桃園市大溪區松樹21之12號","91046000","核准設立","2017-11-01 03:32:41.01"
"27287127","新禮實業有限公司","陳O慎","新北市板橋區幸福路32巷15之1號","null","核准設立","2017-11-01 03:32:41.01"
"27290262","武川酒業有限公司","","臺北市中山區新生北路2段137巷17號3樓之1","null","解散","2017-11-01 03:32:41.01"
"27295745","三湟有限公司","","彰化縣芬園鄉芬草路一段二八○號","null","解散","2017-11-01 03:32:41.01"
"27296890","六佳電子有限公司","林O蘭","彰化縣秀水鄉福安村中山路513巷6號1樓","null","核准設立","2017-11-01 03:32:41.01"
"27298659","金巴克國際有限公司","","新北市板橋區社後里中正路一六三號一樓","null","廢止","2017-11-01 03:32:41.01"
"27307518","益群生活事業有限公司","","新北市八里區龍形一街19巷1弄11號5樓","null","解散","2017-11-01 03:32:41.01"
"27307876","伯錡生技股份有限公司","方O正","臺中市豐原區民生里市前街30號","500000","核准設立","2017-11-01 03:32:41.01"
"27310680","新國產實業股份有限公司","顏O慈","臺北市中山區林森北路111號4樓","1000000","核准設立","2017-11-01 03:32:41.01"
"27314898","杜拜耳國際開發股份有限公司","","臺北市內湖區民權東路6段123巷20弄10號5樓之2","10000000","解散","2017-11-01 03:32:41.01"
"27316002","台灣惠航國際物流有限公司","顏O慈","臺北市中山區林森北路111號3樓","0","核准設立","2017-11-01 03:32:41.01"
"27316376","景順興業股份有限公司","王O惠","新北市中和區建八路16號2樓","5000000","核准設立","2017-11-01 03:32:41.01"
"27317494","寵物一生股份有限公司","","臺北市士林區士東路２００巷３９號１樓","2610000","解散","2017-11-01 03:32:41.01"
"27317939","泰鴻資訊股份有限公司","","新北市三重區三和路4段101巷14弄16號3樓","8000000","解散","2017-11-01 03:32:41.01"
"27318281","藝拓國際股份有限公司","曾O源","臺北市信義區基隆路1段159號13樓","15000000","核准設立","2017-11-01 03:32:41.01"
"27318557","皓青有限公司","齊O貝","臺北市萬華區漢口街2段106號4樓","null","核准設立","2017-11-01 03:32:41.01"
"27321413","榮陽生醫科技股份有限公司","呂O恆","臺北市南港區南港路3段97號9樓","50000000","核准設立","2017-11-01 03:32:41.01"
"27321504","台灣欣加坡科技股份有限公司","黃O菁","臺北市中山區林森北路111號3樓","10000000","核准設立","2017-11-01 03:32:41.01"
"27322460","永豐泰國際開發有限公司","杜O旭","桃園市大溪區福安里復興路一段263巷142號","0","核准設立","2017-11-01 03:32:41.01"
"27322742","台灣國旅聯合股份有限公司","顏O慈","臺北市中正區館前路6號6樓之3","10000000","核准設立","2017-11-01 03:32:41.01"
"27324474","中華銀聯股份有限公司","曾O仁","臺北市中山區林森北路111號3樓","10000000","核准設立","2017-11-01 03:32:41.01"
"27327373","立得互動資訊股份有限公司","","臺北市松山區東興路２８號１５樓","1000000","解散","2017-11-01 03:32:41.01"
"27327866","文魁數位時尚股份有限公司","","臺北市中正區忠孝西路１段５０號１至４樓及地下１至２樓","32298000","解散","2017-11-01 03:32:41.01"
"27328865","松康健有限公司","","臺北市大同區長安西路６６號３樓之３","null","解散","2017-11-01 03:32:41.01"
"27329983","佶鴻建設股份有限公司","曾O裕","臺北市信義區忠孝東路5段435號5樓","15000000","核准設立","2017-11-01 03:32:41.01"
"27330530","鼎甫資產管理股份有限公司","賴O治","臺北市松山區八德路4段86號6樓","150000000","核准設立","2017-11-01 03:32:41.01"
"27331046","新翔科技股份有限公司","蔡O福","新北市蘆洲區三民路246號7樓","29000000","核准設立","2017-11-01 03:32:41.01"
"27332452","翰揚興業有限公司","","臺北市中正區林森北路５巷１２號５樓","null","解散","2017-11-01 03:32:41.01"
"27332848","倍爾福有限公司","余O宏","臺北市中正區南陽街3號5樓之4","0","核准設立","2017-11-01 03:32:41.01"
"27334888","台灣巨蛋開發股份有限公司","","臺北市大安區忠孝東路4段270號16樓","1000000","解散","2017-11-01 03:32:41.01"
"27334917","米達賽斯股份有限公司","陳O群","臺北市中正區新生南路1段158號10樓","10000000","核准設立","2017-11-01 03:32:41.01"
"27335015","粉紅色創意有限公司","陶O瑩","臺北市大安區延吉街137巷20號2樓","0","核准設立","2017-11-01 03:32:41.01"
"27335198","達邇企業有限公司","","臺北市大同區太原路175巷26號2樓","null","解散","2017-11-01 03:32:41.01"
"27336106","愉悅四季有限公司","鄧O玲","新北市永和區保生路1號13樓-3","null","核准設立","2017-11-01 03:32:41.01"
"27337105","忠訓國際股份有限公司","陳O弘","臺北市松山區南京東路4段1號5樓","23528260","核准設立","2017-11-01 03:32:41.01"
"27337604","美琪餐廳股份有限公司","黃O香","臺北市中山區敬業一路160號3樓","5000000","核准設立","2017-11-01 03:32:41.01"
"27338343","加利利開發股份有限公司","簡O卿","基隆市中正區新豐街488-2號17樓","28000000","核准設立","2017-11-01 03:32:41.01"
"27341662","凱薩琳生技國際有限公司","楊O惠","臺北市內湖區康寧路1段81號3樓","null","核准設立","2017-11-01 03:32:41.01"
"27343606","米蘭國際開發有限公司","游O瑛","臺北市中正區沅陵街4號2樓","0","核准設立","2017-11-01 03:32:41.01"
"27343654","富聯心傳健康股份有限公司","","臺北市松山區光復北路９５號３樓","5000000","解散","2017-11-01 03:32:41.01"
"27344534","金禾泰股份有限公司","","臺北市中山區建國北路２段１４７號７樓之５","1000000","廢止","2017-11-01 03:32:41.01"
"27347981","梅鐸多媒體行銷有限公司","","臺北市中山區長安東路２段１６１號","null","解散","2017-11-01 03:32:41.01"
"27349101","宓芝生技化妝品有限公司","李O龍","新北市新莊區思源路173號10樓","null","核准設立","2017-11-01 03:32:41.01"
"27349643","特力事務股份有限公司","","臺北市大安區忠孝東路４段２７０號８樓","50000000","解散","2017-11-01 03:32:41.01"
"27352219","浩瀚精品事業有限公司","","新北市永和區永和路1段166號地下1樓","null","解散","2017-11-01 03:32:41.01"
"27352695","台灣邁捷實業股份有限公司","","臺北市大安區忠孝東路４段５４號１Ｏ樓","1000000","解散","2017-11-01 03:32:41.01"
"27354645","山弘造紙股份有限公司","","臺北市中山區龍江路149巷26號1樓","12000000","解散","2017-11-01 03:32:41.01"
"27354954","鉅樸貿易有限公司","柯O忠","臺南市南區國民路165巷21弄47號1樓","0","核准設立","2017-11-01 03:32:41.01"
"27355362","金漢威股份有限公司","林O我","臺北市中山區林森北路111號4樓","1000000","核准設立","2017-11-01 03:32:41.01"
"27355481","瀛廣興業有限公司","曾O菁","臺北市中山區林森北路510號3樓","0","核准設立","2017-11-01 03:32:41.01"
"27356382","億網智慧股份有限公司","","臺北市南港區忠孝東路６段２３６號２樓","5000000","廢止","2017-11-01 03:32:41.01"
"27357592","多利摩國際有限公司","","臺北市大安區通化街１２０巷１６號","null","廢止","2017-11-01 03:32:41.01"
"27357642","尚誼精品股份有限公司","","臺北市松山區南京東路3段261號6樓","1500000","解散","2017-11-01 03:32:41.01"
"27357713","柏盈數位科技股份有限公司","","臺北市大安區敦化南路２段５７號６樓","5000000","解散","2017-11-01 03:32:41.01"
"27360111","億立購國際有限公司","","臺北市南港區忠孝東路６段２３６號２樓","null","廢止","2017-11-01 03:32:41.01"
"27362244","遠東都會股份有限公司","徐O芳","臺北市大安區仁愛路4段64號7樓","500000000","核准設立","2017-11-01 03:32:41.01"
"27363546","元陞國際有限公司","潘O娟","新北市三峽區二鬮路136巷119號8樓","0","核准設立","2017-11-01 03:32:41.01"
"27364046","欣瑞豐國際股份有限公司","","新北市板橋區文化路１段２５９號","18000000","解散","2017-11-01 03:32:41.01"
"27365100","全球中文網科技股份有限公司","唐O寧","臺北市松山區敦化北路167號12樓","5000000","核准設立","2017-11-01 03:32:41.01"
"27365333","怡映股份有限公司","劉O和","臺北市松山區敦化北路207號13樓之4","200000000","核准設立","2017-11-01 03:32:41.01"
"27366065","銀荷藝術銀彩有限公司","周O穎","新北市新店區建國路257號6樓之20","0","核准設立","2017-11-01 03:32:41.01"
"27366570","卜康科技股份有限公司","林O達","臺北市中山區林森北路111號3樓","10000000","核准設立","2017-11-01 03:32:41.01"
"27367249","亞路科技股份有限公司","許O衛","臺北市松山區南京東路4段1號8樓","10000000","核准設立","2017-11-01 03:32:41.01"
"27367472","和翔國際媒體有限公司","","臺北市中山區敬業一路160號6樓","null","解散","2017-11-01 03:32:41.01"
"27367775","樂活購有限公司","呂O婷","臺北市中山區復興北路150號12樓之6","0","核准設立","2017-11-01 03:32:41.01"
"27368583","上緯國際股份有限公司","","臺北市中山區錦州街１６號４樓之３","1000000","解散","2017-11-01 03:32:41.01"
"27368818","耀北實業有限公司","","臺中市南區忠明南路９０２號１樓","null","廢止","2017-11-01 03:32:41.01"
"27371237","廣佳國際有限公司","林O泰","新北市蘆洲區水湳街94號3樓　","0","核准設立","2017-11-01 03:32:41.01"
"27375445","維冠科技有限公司","","臺中市北區淡溝里民權路三六一號六樓","null","廢止","2017-11-01 03:32:41.01"
"27380257","福鼎科技有限公司","許O貞","桃園市觀音區中山路二段601號","null","核准設立","2017-11-01 03:32:41.01"
"27382918","烽宇企業有限公司","留O萍","新北市蘆洲區光華路186巷39號5樓","null","核准設立","2017-11-01 03:32:41.01"
"27387651","鼓力行銷整合有限公司","王O博","新北市新店區寶橋路235巷126號3樓","null","核准設立","2017-11-01 03:32:41.01"
"27393909","亞仕多企業股份有限公司","蔡O真","南投縣埔里鎮大城路29巷30號1樓","15000000","核准設立","2017-11-01 03:32:41.01"
"27396075","購物長城頻道股份有限公司","陳O元","彰化縣永靖鄉五福村中山路1段30號","6000000","核准設立","2017-11-01 03:32:41.01"
"27398242","久綖興業有限公司","鄭O嫻","臺中市東區東門里東福一街21巷25號1樓","0","核准設立","2017-11-01 03:32:41.01"
"27399621","光謚電器貿易有限公司","許O雄","新北市中和區員山路394巷12弄8號1樓","null","核准設立","2017-11-01 03:32:41.01"
"27400465","上城建設股份有限公司","雷O程","臺中市西區民生里自由路一段128號1，2樓地下室","60000000","核准設立","2017-11-01 03:32:41.01"
"27403060","馬上停停車場股份有限公司","雷O程","臺中市烏日區三和里高鐵三路2號","20000000","核准設立","2017-11-01 03:32:41.01"
"27407354","維京風華有限公司","趙O豪","桃園市平鎮區高雙里長安路1巷16號2樓","null","核准設立","2017-11-01 03:32:41.01"
"27413308","殷杭國際有限公司","","新北市汐止區新台五路一段一七七號一樓","null","解散","2017-11-01 03:32:41.01"
"27413638","康褔科技有限公司","曹O耀","桃園市八德區大智里福國北街195巷10號","null","核准設立","2017-11-01 03:32:41.01"
"27415137","誠威國際有限公司","","臺南市永康區永大路三段416號1樓","null","解散","2017-11-01 03:32:41.01"
"27420645","拓邦實業有限公司","","新北市新莊區中泰街三○號","null","廢止","2017-11-01 03:32:41.01"
"27420862","普鉅資訊有限公司","陳O憲","臺中市烏日區烏日里永春東三南路95巷12號1樓","0","核准設立","2017-11-01 03:32:41.01"
"27424972","格富資訊科技有限公司","","新北市板橋區民生路三段三○號二樓之六","null","解散","2017-11-01 03:32:41.01"
"27428816","辰茂實業有限公司","林O蘭","新竹縣竹北市博愛街362號3樓","0","核准設立","2017-11-01 03:32:41.01"
"27430263","仁佐國際有限公司","翁O勝","新北市板橋區僑中一街80巷6弄3之3號4樓","null","核准設立","2017-11-01 03:32:41.01"
"27430735","羅福國際實業股份有限公司","蔡O唐","彰化縣鹿港鎮海埔里鹿工北一路15號1樓","20000000","核准設立","2017-11-01 03:32:41.01"
"27431208","慧理實業有限公司","","桃園市中壢區興仁路二段一五二號四樓","null","廢止","2017-11-01 03:32:41.01"
"27435458","陸行有限公司","謝O珍","基隆市中山區中和路168巷10弄5號","0","核准設立","2017-11-01 03:32:41.01"
