"統一編號","公司名稱","負責人","公司地址","實收資本額","公司狀態","產製日期"
"54504176","翔意國際有限公司","蕭O輝","臺北市松山區民權東路3段104號3樓","0","核准設立","2017-11-01 03:32:41.01"
"54505294","亞禾海洋生技有限公司","何O慶","基隆市七堵區自強路124號3樓","null","核准設立","2017-11-01 03:32:41.01"
"54505463","萬力實業有限公司","吳O忠","新竹市東區新莊里6鄰關新路213號17樓之5","null","核准設立","2017-11-01 03:32:41.01"
"54505604","埔里有限公司","洪O彥","南投縣南投市平山里彰南路三段2巷4弄28號1樓","null","核准設立","2017-11-01 03:32:41.01"
"54508172","啟動國際商場有限公司","曾O堂","新竹市復中里中央路183號2樓","null","核准設立","2017-11-01 03:32:41.01"
"54508193","大日物產股份有限公司","廖O","屏東縣潮州鎮光華里盧山路45號","5000000","核准設立","2017-11-01 03:32:41.01"
"54509411","萬檟國際生物科技有限公司","簡O嬅","嘉義縣竹崎鄉灣橋村崎腳189號1樓","null","核准設立","2017-11-01 03:32:41.01"
"54512268","利誠貿易有限公司","劉O隆","桃園市平鎮區東安里龍安路163號","0","核准設立","2017-11-01 03:32:41.01"
"54513386","玉凰國際貿易有限公司","柯O倫","彰化縣伸港鄉定興路134-5號1樓","null","核准設立","2017-11-01 03:32:41.01"
"54513891","金文潭有限公司","吳O達","桃園市平鎮區廣泰路75之2號","null","核准設立","2017-11-01 03:32:41.01"
"54514651","致行股份有限公司","顏O村","臺北市大安區信義路4段6號16樓之1","2000000","核准設立","2017-11-01 03:32:41.01"
"54514738","台灣凱瑞光學有限公司","EOgen Dumitrescu","桃園市中壢區安東路5號3樓","0","核准設立","2017-11-01 03:32:41.01"
"54515309","澎湖家股份有限公司","","澎湖縣馬公市西文里西文澳63之55號1樓","2000000","解散","2017-11-01 03:32:41.01"
"54515455","翔茂國際開發股份有限公司","蕭O清","苗栗縣竹南鎮大埔里科專三路292號一樓","2000000","核准設立","2017-11-01 03:32:41.01"
"54515650","集祥里有限公司","黃O元","宜蘭縣羅東鎮民生路38號","null","核准設立","2017-11-01 03:32:41.01"
"54517340","理想家交易網企業有限公司","","新竹縣竹北市縣政二路55號7樓之1","0","廢止","2017-11-01 03:32:41.01"
"54517566","恭寶農業生物科技有限公司","彭O珠","桃園市中壢區仁福里仁德街18號1樓","0","核准設立","2017-11-01 03:32:41.01"
"54519797","果果貿易洋行有限公司","許O閔","桃園市大溪區一心里中華路232號1樓","null","核准設立","2017-11-01 03:32:41.01"
"54520823","夆元蔬果有限公司","","基隆市中山區中和路168巷14弄12號","0","解散","2017-11-01 03:32:41.01"
"54520859","鉅唐國際企業有限公司","唐O澧","彰化縣花壇鄉中口村中山路二段569號","0","核准設立","2017-11-01 03:32:41.01"
"54521127","星研科集有限公司","王O山","桃園市平鎮區義民里復旦路2段117巷10號1樓","null","核准設立","2017-11-01 03:32:41.01"
"54521153","柏鉻富股份有限公司","王O山","桃園市平鎮區義民里復旦路二段117巷10號1樓","1200000","核准設立","2017-11-01 03:32:41.01"
"54521647","和新有限公司","","彰化縣秀水鄉福安村彰水路二段481號1樓","0","解散","2017-11-01 03:32:41.01"
"54522293","松泰資產管理股份有限公司","廖O翔","嘉義市西區國華里文化路299號","400000000","核准設立","2017-11-01 03:32:41.01"
"54522391","婕米爾國際生醫有限公司","韋O妍","彰化縣鹿港鎮頂厝里明智路18巷7號1樓","null","核准設立","2017-11-01 03:32:41.01"
"54524145","全國麗園大飯店有限公司","李O聰","彰化縣花壇鄉橋頭村花南路33號","0","核准設立","2017-11-01 03:32:41.01"
"54524573","允發國際貿易股份有限公司","魏O國","嘉義市東區興仁里軍輝路158號1樓","2080000","核准設立","2017-11-01 03:32:41.01"
"54526381","超簡工程有限公司","陳O姚","彰化縣彰化市西安里曉陽路208巷5號1樓","0","核准設立","2017-11-01 03:32:41.01"
"54526951","泰樂福有限公司","丁O郎","彰化縣埔鹽鄉西湖村大新路2巷28之10號","0","核准設立","2017-11-01 03:32:41.01"
"54527305","究識好策略文創有限公司","郭O佑","彰化縣田中鎮北路里中正路648號1樓","0","核准設立","2017-11-01 03:32:41.01"
"54527396","萬寶國際電子商務股份有限公司","","臺北市信義區基隆路1段68號9樓","30000000","廢止","2017-11-01 03:32:41.01"
"54527699","達巖資訊有限公司","王O佑","雲林縣口湖鄉崙中村民生路129-1號","null","核准設立","2017-11-01 03:32:41.01"
"54527868","景力生物科技有限公司","陳O婷","彰化縣彰化市華陽里南郭路一段198號1樓","0","核准設立","2017-11-01 03:32:41.01"
"54528515","和美企業有限公司","","屏東縣潮州鎮永春里永德路77巷5號1樓","null","解散","2017-11-01 03:32:41.01"
"54529697","錡鈁股份有限公司","洪O捷","新竹市東區前溪里經國路一段306號1樓","2400000","核准設立，但已命令解散","2017-11-01 03:32:41.01"
"54529774","絲路興業有限公司","吳O霖","新竹市香山區埔前路230號","null","核准設立","2017-11-01 03:32:41.01"
"54530456","暐夏投資開發股份有限公司","林O和","新竹縣竹北市復興三路二段168號8樓之2","301680000","核准設立","2017-11-01 03:32:41.01"
"54530688","藍和百貨股份有限公司","藍O賓","桃園市桃園區文化里中華路55號","10000000","核准設立","2017-11-01 03:32:41.01"
"54533242","大黃河國際貿易有限公司","康O興","桃園市新屋區校前一街23巷2號","null","核准設立","2017-11-01 03:32:41.01"
"54534988","大來一品有限公司","彭O鈺","彰化縣溪湖鎮華中街15巷28號1樓","null","核准設立","2017-11-01 03:32:41.01"
"54535311","快取寶股份有限公司","","嘉義市東區安寮里興業東路48號1樓","150000000","核准設立","2017-11-01 03:32:41.01"
"54535467","宏億資訊有限公司","沈O鵬","桃園市桃園區長安里力行路66號1樓","null","核准設立","2017-11-01 03:32:41.01"
"54538936","里昂庭企業有限公司","黃O勻","桃園市中壢區永光里環西路二段290號一樓","0","核准設立","2017-11-01 03:32:41.01"
"54539816","上寶國際貿易股份有限公司","","屏東縣琉球鄉本福村中山路52之6號1樓","50000000","解散","2017-11-01 03:32:41.01"
"54541475","環宇行動科技有限公司","施O亭","彰化縣鹿港鎮中正路259-1號1樓","0","核准設立","2017-11-01 03:32:41.01"
"54543380","順翔翼科技有限公司","徐O質","基隆市中正區觀海街43號13樓","0","核准設立","2017-11-01 03:32:41.01"
"54543939","霖園國際股份有限公司","李O霖","桃園市桃園區玉山里漢中路155巷20號(1樓)","2000000","核准設立","2017-11-01 03:32:41.01"
"54545578","鹿德社會企業股份有限公司","林O雪","高雄市前鎮區民權二路220巷9號18樓","605000","核准設立","2017-11-01 03:32:41.01"
"54545958","御閣實業有限公司","陳O仁","嘉義市西區美源里興業西路113號1樓","0","核准設立","2017-11-01 03:32:41.01"
"54546128","恒鼎食品股份有限公司","戴O樟","桃園市蘆竹區新莊里大新路668號2樓","29500000","核准設立","2017-11-01 03:32:41.01"
"54546133","國世德國際多媒體股份有限公司","曾O全","桃園市平鎮區北安里延平路一段2號3樓","50000000","核准設立","2017-11-01 03:32:41.01"
"54546247","芸崴國際餐飲事業有限公司","黃O雄","新竹縣竹東鎮雞林里大明路318號","0","核准設立","2017-11-01 03:32:41.01"
"54546611","永榮電子有限公司","","桃園市大園區北港里自立一街24-1號","null","解散","2017-11-01 03:32:41.01"
"54549434","淳粹工坊有限公司","鄭O卿","臺南市東區裕聖里裕敬路258號1樓","null","核准設立","2017-11-01 03:32:41.01"
"54549482","全國企業有限公司","劉O賢","臺南市南區建南里永成路2段587號","null","核准設立","2017-11-01 03:32:41.01"
"54550348","無疆界文化傳媒科技有限公司","","臺南市善化區文昌里光復路265號1樓","null","解散","2017-11-01 03:32:41.01"
"54551917","煜升貿易有限公司","黃O瑜","臺南市安平區永華路2段248號21樓之1","null","核准設立","2017-11-01 03:32:41.01"
"54552401","夢時代數位國際有限公司","","臺南市南區塩埕路159巷5號4樓","null","廢止","2017-11-01 03:32:41.01"
"54552943","上鑽投資顧問有限公司","鍾O昌","臺南市中西區保安里中正路239號1樓","0","核准設立","2017-11-01 03:32:41.01"
"54552958","有臣有限公司","","臺南市中西區赤崁里中成路39號1樓","0","解散","2017-11-01 03:32:41.01"
"54555420","璨驛股份有限公司","楊O美","臺南市中西區保安里海安路1段188號地下1、2樓","80000000","核准設立","2017-11-01 03:32:41.01"
"54556321","超力建設有限公司","","臺南市南區田寮里新興路361號3樓之8","0","解散","2017-11-01 03:32:41.01"
"54559875","加倍旺有限公司","","臺南市安南區溪心里海佃路二段627號1樓","0","解散","2017-11-01 03:32:41.01"
"54560009","龐得飲食股份有限公司","袁O瑩","臺北市松山區延吉街46巷7號1樓","500000","核准設立","2017-11-01 03:32:41.01"
"54561324","苡菈飾品配件有限公司","楊O羽","臺南市中西區中正里國華街三段15號1樓","0","核准設立","2017-11-01 03:32:41.01"
"54561653","禾興開發股份有限公司","陳O興","臺南市安平區國平里建平五街181號1樓","70000000","核准設立","2017-11-01 03:32:41.01"
"54561730","捷思唯數位整合股份有限公司","林O 　　","臺南市新化區東榮里中興路748號1樓","15000000","核准設立","2017-11-01 03:32:41.01"
"54562920","黃太陽有限公司","謝O霓","臺南市永康區二王里中山南路490巷1號","0","核准設立","2017-11-01 03:32:41.01"
"54563131","和大汽車有限公司","余O泰","臺南市東區德高里仁和路191號1樓","null","核准設立","2017-11-01 03:32:41.01"
"54563569","研綺國際貿易有限公司","李O荃","臺南市東區仁東街19號11樓之3","null","核准設立","2017-11-01 03:32:41.01"
"54564743","健聖有限公司","吳O展","臺南市北區立賢路2段87號1樓","null","核准設立","2017-11-01 03:32:41.01"
"54564928","金源陞股份有限公司","陳O雅","臺南市西港區慶安里新興街25號1樓","20000000","核准設立","2017-11-01 03:32:41.01"
"54564976","騰達生技股份有限公司","","臺南市仁德區仁義里仁義三街83號1樓","300000","解散","2017-11-01 03:32:41.01"
"54565166","吾甲春有限公司","吳O興","臺南市東區富強里中華東路二段48巷25弄20號","null","核准設立","2017-11-01 03:32:41.01"
"54565270","新琦科技有限公司","蘇O","臺南市東區泉南里林森路1段149號7樓之9","0","核准設立","2017-11-01 03:32:41.01"
"54565356","佐治藥舖股份有限公司","蔡O義","臺南市永康區王行里環工路11號","20000000","核准設立","2017-11-01 03:32:41.01"
"54565969","震宇電能科技有限公司","周O正","臺南市新營區護鎮里中正路439巷127之1號1樓","null","核准設立","2017-11-01 03:32:41.01"
"54567734","愛家概念有限公司","蔡O宇","臺南市西港區西港里5鄰文化路83巷2號1樓","null","核准設立","2017-11-01 03:32:41.01"
"54569521","喬葳企業有限公司","陳O芸","臺南市新營區延平里成功街26、28號1樓","null","核准設立","2017-11-01 03:32:41.01"
"54569971","法拉國際企業有限公司","陳O震","臺南市佳里區民安里同安寮77之24號1樓","null","核准設立","2017-11-01 03:32:41.01"
"54571857","聚落文創有限公司","劉O滄","臺南市中西區三合里康樂街336號1樓","null","核准設立","2017-11-01 03:32:41.01"
"54573026","千合佳莉莉有限公司","蘇O女屏","臺南市鹽水區三生里朝琴路33、35、37號1樓","0","核准設立","2017-11-01 03:32:41.01"
"54574600","品川國際開發股份有限公司","鍾O霖","臺南市安平區怡平里華平路672巷2號","10000000","核准設立","2017-11-01 03:32:41.01"
"54574762","永力興鋼鐵工業有限公司","","臺南市永康區正南一街199號","0","解散","2017-11-01 03:32:41.01"
"54578486","華茂云開發有限公司","","臺南市中西區元安里永華路一段42-1號2樓","0","解散","2017-11-01 03:32:41.01"
"54582566","巴布饌餐廳有限公司","","臺中市西區大昌街217號1樓","0","解散","2017-11-01 03:32:41.01"
"54583559","迪爾國際有限公司","陳O宏","臺中市西屯區福林里福科路561號","0","核准設立","2017-11-01 03:32:41.01"
"54583919","平安烘焙股份有限公司","","臺中市西區向上路一段79巷72號2樓","500000","解散","2017-11-01 03:32:41.01"
"54585867","義達軒實業有限公司","劉O凱","臺中市潭子區福仁里大新路61號1樓","0","核准設立","2017-11-01 03:32:41.01"
"54586036","達米蟲國際股份有限公司","賴O奇","臺中市北區淡溝里民權路472-1號","5000000","核准設立","2017-11-01 03:32:41.01"
"54586752","亞太一零八聯合協誠國際有限公司","王O萍","臺中市南區南和里工學北路115號17樓之5","0","核准設立","2017-11-01 03:32:41.01"
"54587035","我形地產開發事業有限公司","","花蓮縣花蓮市民意里化道路89巷2號3樓","null","解散","2017-11-01 03:32:41.01"
"54587149","翡翠森林生物科技有限公司","侯O仁","臺中市西屯區何仁里天水東二街9-2號","0","核准設立","2017-11-01 03:32:41.01"
"54587345","東宇建設有限公司","林O原","臺中市南屯區三和里大墩十一街816號1樓","null","核准設立","2017-11-01 03:32:41.01"
"54588800","陞運國際企業有限公司","","臺中市西區公正里大進街122號3樓之1","null","解散","2017-11-01 03:32:41.01"
"54590876","立城有限公司","徐O忠","臺中市西區民生北路151號1樓","0","核准設立","2017-11-01 03:32:41.01"
"54591523","鑫佑有限公司","陳O滿","臺中市南屯區文山里保安五街189、199號","0","核准設立","2017-11-01 03:32:41.01"
"54592635","樂活全球實業股份有限公司","羅O庚","臺中市南區忠明南路758號38樓","10000000","核准設立","2017-11-01 03:32:41.01"
"54595204","舞漾奇蹟有限公司","","臺中市沙鹿區北勢里中棲路東明巷171弄5號1樓","null","解散","2017-11-01 03:32:41.01"
"54597553","愛斯精品國際有限公司","陳O蓉","臺中市西區昇平里向上路一段89號1樓","0","核准設立","2017-11-01 03:32:41.01"
"54597907","海森日用品有限公司","鄭O奇","臺中市南區忠明南路760號13樓","null","核准設立","2017-11-01 03:32:41.01"
"54598504","宏固人力資源有限公司","溫O洪","臺中市西屯區工業區一路58巷11弄42號1樓","0","核准設立","2017-11-01 03:32:41.01"
"54598835","宸宇欣業有限公司","王O民","臺北市中山區長安東路1段21號11樓","null","核准設立","2017-11-01 03:32:41.01"
"54601959","世紀中華開發股份有限公司","","臺中市北區金龍街42-6號","60000","廢止","2017-11-01 03:32:41.01"
"54602612","赤商國際股份有限公司","林O凱","臺中市西屯區何福里寧夏路180號2樓","4000000","核准設立","2017-11-01 03:32:41.01"
"54603247","展浩整合行銷有限公司","黃O宇","臺中市西屯區何德里甘州六街30號1樓","0","核准設立","2017-11-01 03:32:41.01"
"54603865","遠見服務行銷股份有限公司","張O霞","臺中市南屯區三厝街226之1號5樓之2","1000000","核准設立","2017-11-01 03:32:41.01"
"54604695","誠鎰開發有限公司","葉O銘","臺中市豐原區南村里水源路599巷8號1樓","null","核准設立","2017-11-01 03:32:41.01"
"54605076","瑪聯國際行銷有限公司","徐O村","臺中市豐原區西湳里葫蘆墩一街177號","0","核准設立","2017-11-01 03:32:41.01"
"54605168","魔髮獅股份有限公司","陳O任","臺中市西屯區大容西街67號3樓之2","1000000","核准設立","2017-11-01 03:32:41.01"
"54606477","中倫能量科技有限公司","蔡O倫","臺中市西屯區何厝里青海路一段14之1號1樓","null","核准設立","2017-11-01 03:32:41.01"
"54606808","華人人力資源管理顧問有限公司","夏O美","臺中市西區民龍里臺灣大道二段309號4樓之2","0","核准設立","2017-11-01 03:32:41.01"
"54607068","福爾摩沙國際旅館管理顧問有限公司","余O銓","臺中市北區六合里福龍街99號之1","0","核准設立","2017-11-01 03:32:41.01"
"54607222","金泰餐飲股份有限公司","洪O文","臺中市梧棲區草湳里臨港路三段9號","25000000","核准設立","2017-11-01 03:32:41.01"
"54608572","宏旻國際有限公司","紀O昇","臺中市梧棲區中正里中興路128巷172號1樓","0","核准設立","2017-11-01 03:32:41.01"
"54610514","台灣徵信有限公司","崔O均","高雄市前金區大同二路135之1號4樓之1","0","核准設立","2017-11-01 03:32:41.01"
"54611767","富聯通信有限公司","","高雄市三民區鼎力路345號1樓","null","解散","2017-11-01 03:32:41.01"
"54611838","品蓁禮品有限公司","葉O蓁","高雄市鳳山區華西街15號1樓","null","核准設立","2017-11-01 03:32:41.01"
"54612415","尚品國際精品有限公司","","高雄市前金區河東路304號3樓","0","解散","2017-11-01 03:32:41.01"
"54612858","義大環球國際股份有限公司","李O賢","高雄市大樹區學城路1段5號3樓","20000000","核准設立","2017-11-01 03:32:41.01"
"54612870","華聚興盛國際股份有限公司","","高雄市鳥松區球場路21號2樓","3000000","解散","2017-11-01 03:32:41.01"
"54613364","久本和有限公司","吳O成","高雄市左營區翠華路591號","0","核准設立","2017-11-01 03:32:41.01"
"54617072","西子灣海洋食品股份有限公司","","高雄市新興區復興一路57號5樓之4","800000","解散","2017-11-01 03:32:41.01"
"54617100","隆遠太平洋貿易有限公司","王O遠","高雄市前鎮區漁港南一路39號","null","核准設立","2017-11-01 03:32:41.01"
"54617657","遠謙國際有限公司","","高雄市仁武區仁林路8號1樓","null","解散","2017-11-01 03:32:41.01"
"54617690","捷美有限公司","陳O金","高雄市鼓山區中華一路21號5樓","null","核准設立","2017-11-01 03:32:41.01"
"54618059","祥信投資開發股份有限公司","吳O毅","高雄市鼓山區美術東五路21號1樓","7121492","核准設立","2017-11-01 03:32:41.01"
"54620359","立有建築開發股份有限公司","邱O泰","高雄市苓雅區正大路85號4樓","15000000","核准設立","2017-11-01 03:32:41.01"
"54621532","織女星服飾有限公司","朱O誠","高雄市鳳山區中央路160巷1弄20號1樓","null","核准設立","2017-11-01 03:32:41.01"
"54622552","陪你有限公司","池O慧","高雄市鼓山區華榮路290號","0","核准設立","2017-11-01 03:32:41.01"
"54622933","微笑購物國際科技有限公司","許O婷","高雄市楠梓區土庫三路251巷1號17樓","0","核准設立","2017-11-01 03:32:41.01"
"54623519","安程消防工程有限公司","黃O傑","高雄市路竹區竹滬里華光路6號1樓","null","核准設立","2017-11-01 03:32:41.01"
"54624502","尚旺來國際有限公司","邱O紅","臺南市永康區六合里中華路425號18樓之9","0","核准設立","2017-11-01 03:32:41.01"
"54626662","東京健康美學有限公司","李O騰","高雄市仁武區大景二街95號2樓","0","核准設立","2017-11-01 03:32:41.01"
"54628161","美德欣有限公司","邱O華","高雄市左營區文府路108號","0","核准設立","2017-11-01 03:32:41.01"
"54629274","冠蓁企業有限公司","陳O蓁","高雄市大寮區崇偉路62號","0","核准設立","2017-11-01 03:32:41.01"
"54630005","墨凡有限公司","薛O鴻","高雄市左營區重信路557號3樓","0","核准設立","2017-11-01 03:32:41.01"
"54630321","海晴國際有限公司","王O釵","高雄市左營區博愛二路366號7樓之5","0","核准設立","2017-11-01 03:32:41.01"
"54631068","一二三手機零件有限公司","黃O峰","高雄市三民區建國二路49號1樓","null","核准設立","2017-11-01 03:32:41.01"
"54631594","東南資產開發股份有限公司","陳O斷","高雄市前金區五福三路21號5樓之1","290000000","核准設立","2017-11-01 03:32:41.01"
"54631665","名葉實業有限公司","曾O珍","高雄市三民區大豐二路628巷9號1樓","0","核准設立","2017-11-01 03:32:41.01"
"54632019","義大視覺特效股份有限公司","沈O村","高雄市大樹區學城路一段9號2樓","30000000","核准設立","2017-11-01 03:32:41.01"
"54633592","拉布蘭雪兒有限公司","許O文","高雄市新興區六合一路87號1樓","null","核准設立","2017-11-01 03:32:41.01"
"54634678","樹的可能文化創意有限公司","","高雄市新興區新田路57號1樓","0","解散","2017-11-01 03:32:41.01"
"54634712","武廟町管理顧問有限公司","孟O中","高雄市鼓山區神農路161號15樓","0","核准設立","2017-11-01 03:32:41.01"
"54634987","霏龍國際有限公司","郭O昌","高雄市小港區鋼成街東巷14之1號","0","核准設立","2017-11-01 03:32:41.01"
"54635769","優必貝思特有限公司","丁O利","臺北市松山區八德路4段665號","null","核准設立","2017-11-01 03:32:41.01"
"54636373","麗勝全球股份有限公司","林O勝","高雄市前金區成功一路420號地下一層之1","10000000","核准設立","2017-11-01 03:32:41.01"
"54636887","靜安仕股份有限公司","李O堅","高雄市苓雅區廣州二街82號2樓","5000000","核准設立","2017-11-01 03:32:41.01"
"54637648","熊氏企業有限公司","","高雄市三民區大昌一路301巷1弄3之15號","0","解散","2017-11-01 03:32:41.01"
"54637886","豐淯建設股份有限公司","賴O明","高雄市苓雅區自強三路3號31樓之11","35000000","核准設立","2017-11-01 03:32:41.01"
"54638554","臻富開發有限公司","楊O風","高雄市三民區十全一路101號1樓","0","核准設立","2017-11-01 03:32:41.01"
"54638978","渝富企業有限公司","","高雄市林園區五福路166號","null","解散","2017-11-01 03:32:41.01"
"54639548","榮星有限公司","蔡O堯","臺北市大安區忠孝東路4段169號11樓之4","0","核准設立","2017-11-01 03:32:41.01"
"54639929","樂奕投資股份有限公司","郭O祥","臺北市內湖區港墘路183號11樓","100000000","核准設立","2017-11-01 03:32:41.01"
"54639940","建京興業有限公司","林O齊","臺北市萬華區西藏路270號2樓","null","核准設立","2017-11-01 03:32:41.01"
"54641164","競佳國際貿易有限公司","李O華","臺北市大安區忠孝東路4段329號9樓","0","核准設立","2017-11-01 03:32:41.01"
"54641170","大墨國際開發有限公司","莊O隆","臺北市信義區虎林街202巷64號1樓","null","核准設立","2017-11-01 03:32:41.01"
"54641376","洲子牙股份有限公司","張O潤","臺北市中正區忠孝西路1段7號9樓之2","5000000","核准設立","2017-11-01 03:32:41.01"
"54642939","崇美生醫科技有限公司","","臺北市松山區南京南路4段130號2樓之1","null","解散","2017-11-01 03:32:41.01"
"54643753","藍天雲端科技有限公司","陳O翰","臺北市信義區信義路4段415號14樓之1","null","核准設立","2017-11-01 03:32:41.01"
"54645204","宜家商旅實業股份有限公司","石O杰","臺北市內湖區成功路2段512號","168000000","核准設立","2017-11-01 03:32:41.01"
"54645605","雍哲有限公司","柯O雍","臺北市大安區和平東路3段258號9樓","null","核准設立","2017-11-01 03:32:41.01"
"54646132","錡躍國際有限公司","吳O瑩","臺北市大同區重慶北路3段139號7樓","null","核准設立","2017-11-01 03:32:41.01"
"54646230","世界夢公園企業股份有限公司","鄭O晴","臺北市北投區中央南路2段31號3樓","118545720","核准設立","2017-11-01 03:32:41.01"
"54646457","旭淂國際資訊科技有限公司","黃O怡","臺北市信義區光復南路473巷11弄29號1樓","0","核准設立","2017-11-01 03:32:41.01"
"54646983","富駿實業有限公司","","臺北市信義區松山路421號16樓之3","null","解散","2017-11-01 03:32:41.01"
"54647081","天致服飾有限公司","徐O泰","臺北市南港區三重路19之11號15樓","0","核准設立","2017-11-01 03:32:41.01"
"54647646","愛毛孩企業有限公司","呂O筠","花蓮縣花蓮市主義里南京街228號","null","核准設立","2017-11-01 03:32:41.01"
"54648096","緣果文創有限公司","鄭O盈","臺北市大安區復興南路2段237號13樓","0","核准設立","2017-11-01 03:32:41.01"
"54648743","森活健康事業股份有限公司","汪O麟","臺北市大安區復興南路1段368號8樓","5000000","核准設立","2017-11-01 03:32:41.01"
"54648791","健樂福生活事業股份有限公司","楊O碩","臺北市大安區仁愛路3段30號8樓","70000000","核准設立","2017-11-01 03:32:41.01"
"54649095","維宸傳播有限公司","林O標","臺北市信義區基隆路1段141號3樓之1","0","核准設立","2017-11-01 03:32:41.01"
"54649378","巴拉國際股份有限公司","","臺北市內湖區洲子街62號5樓","2000000","解散","2017-11-01 03:32:41.01"
"54649383","潤龍科技有限公司","柯O興","臺北市信義區中坡南路201巷4之1號","0","核准設立","2017-11-01 03:32:41.01"
"54650389","百妍生技股份有限公司","","臺北市信義區忠孝東路4段516號2樓之1","1000000","解散","2017-11-01 03:32:41.01"
"54650472","兆全股份有限公司","王O賢","臺北市信義區松仁路90號2樓","2000000","核准設立","2017-11-01 03:32:41.01"
"54650965","康美國際行銷有限公司","","臺北市信義區中坡南路28號7樓","0","解散","2017-11-01 03:32:41.01"
"54651211","富可企業有限公司","陳O薇","臺北市中正區中華路1段59號7樓","null","核准設立","2017-11-01 03:32:41.01"
